{
 "schema_version": 1,
 "project": "codemap",
 "project_key": "3745ad472230",
 "index_fingerprint": "506f5a0a426240757434cb76031ba93997f442278cc2dcaa05200bef947e509f",
 "offset": 0,
 "limit": 2,
 "max_content_bytes": 16384,
 "total_records": 6481,
 "returned_records": 2,
 "complete": false,
 "next_offset": 2,
 "records": [
  {
   "schema_version": 1,
   "ordinal": 1,
   "project": "codemap",
   "project_key": "3745ad472230",
   "index_fingerprint": "506f5a0a426240757434cb76031ba93997f442278cc2dcaa05200bef947e509f",
   "file": ".github/workflows/ci.yml",
   "start_line": 1,
   "end_line": 1,
   "symbol": "name",
   "fqn": ".github/workflows/ci.yml#yaml/name",
   "kind": "key",
   "language": "yaml",
   "signature": "name",
   "docstring": "",
   "source_hash": "8e7430f31889b761a2ccebd73080d82a3491aa7c565a2ea6583bd0f8788ccbd8",
   "content": "name: CI",
   "content_hash": "8e7430f31889b761a2ccebd73080d82a3491aa7c565a2ea6583bd0f8788ccbd8"
  },
  {
   "schema_version": 1,
   "ordinal": 2,
   "project": "codemap",
   "project_key": "3745ad472230",
   "index_fingerprint": "506f5a0a426240757434cb76031ba93997f442278cc2dcaa05200bef947e509f",
   "file": ".github/workflows/ci.yml",
   "start_line": 3,
   "end_line": 7,
   "symbol": "on",
   "fqn": ".github/workflows/ci.yml#yaml/on",
   "kind": "key",
   "language": "yaml",
   "signature": "on",
   "docstring": "",
   "source_hash": "821160c60cf0ec596f01b036e5543df8ab330c6e857c89c93cea228821c8ea01",
   "content": "on:\n  push:\n    branches: [main]\n  pull_request:\n    branches: [main]",
   "content_hash": "821160c60cf0ec596f01b036e5543df8ab330c6e857c89c93cea228821c8ea01"
  }
 ]
}